{
  "defenceClientId": "0d2b7de7-c364-4a39-a87c-012ec06f4990",
  "defenceClientSurname": "WRONGUN",
  "userId": "0d2b7de7-c364-4a39-a87c-012ec06f4990",
  "organisationId": "45e4dff9-581d-4f56-bb15-8303cf43dc87",
  "materialId": "45e4dff9-f829-4514-a344-61f1d5d9690c",
  "accessTimestamp":"2018-03-27T15:32:33.471Z",
  "caseUrn": "55DP0028116"
}