{
  "accessTimestamp": "2018-03-27T15:32:33.471Z",
  "defenceClientId": "a4391788-f829-4514-a344-61f1d5d9690c",
  "defenceClientSurname": "smith",
  "materialId": "45e4dff9-f829-4514-a344-61f1d5d9690c",
  "organisationId": "45e4dff9-581d-4f56-bb15-8303cf43dc87",
  "userId": "0d2b7de7-c364-4a39-a87c-012ec06f4990"
}
